{
  "$schema": "https://tds.internal/schemas/component.v1.json",
  "name": "ImageThumb",
  "version": "1.0.0",
  "level": "atom",
  "category": "Media",
  "taxonomyItem": "image",
  "status": "beta",
  "description": "목록 썸네일 — 작은 이미지. 출처: apps/admin/src/shared/ui/ImageThumb.tsx (소비 3곳: 로고 목록·인증서 목록·리뷰 미리보기). src 가 비었거나(trim 후 빈 문자열) 로드에 실패하면 빈칸/깨진 이미지 대신 이미지 아이콘 placeholder 를 한 곳에서 보장한다. 도메인을 모른다 — 무슨 이미지인지 알지 못하고 src(URL 문자열)와 접근성 이름(alt)만 받는다.\n\n[로드 실패 복구] src 가 바뀌면 실패 플래그를 초기화한다 — 이전 URL 의 실패가 새 URL 로 새지 않는다.",
  "owner": { "code": "component-eng", "design": "ui-design", "figma": "figma-eng" },

  "props": {
    "src": {
      "type": "string",
      "required": true,
      "description": "이미지 URL. 앞뒤 공백을 제거한 뒤 빈 문자열이면 placeholder 를 렌더한다. 로드에 실패해도(onError) placeholder 로 폴백한다"
    },
    "alt": {
      "type": "string",
      "required": true,
      "description": "접근성 이름 — 실제 이미지의 alt 이자 placeholder(role=img)의 aria-label 이다. 두 경로 모두 같은 이름으로 읽힌다"
    }
  },

  "states": ["default", "error"],

  "tokens": {
    "placeholderSurface": "color.surface.raised",
    "placeholderText": "color.text.muted",
    "placeholderBorder": "color.border.default",
    "placeholderRadius": "radius.sm",
    "borderWidth": "border-width.thin"
  },

  "a11y": {
    "role": "img",
    "keyboard": ["none — 비대화형 이미지. 포커스 순서에 들어가지 않는다"],
    "focusVisible": false,
    "aria": {
      "alt-both-paths": "실제 이미지는 alt 로, placeholder(빈 src·로드 실패)는 role=\"img\" + aria-label={alt} 로 같은 접근 가능한 이름을 준다",
      "decorative-icon": "placeholder 안의 이미지 아이콘은 aria-hidden 장식이다 — 접근 가능한 이름은 컨테이너(role=img)가 제공한다"
    },
    "contrastMin": 4.5
  },

  "responsive": {
    "breakpoints": ["sm", "md", "lg"],
    "behavior": "size-fixed"
  },

  "compat": {
    "breakingSince": null,
    "deprecatedProps": []
  },

  "dependencies": []
}
