{
  "$schema": "https://tds.internal/schemas/component.v1.json",
  "name": "SelectField",
  "version": "1.1.0",
  "level": "atom",
  "category": "Inputs",
  "taxonomyItem": "select",
  "status": "beta",
  "description": "드롭다운 컨트롤 — raw <select> 의 무손실 드롭인. 출처: apps/admin/src/shared/ui/SelectField.tsx (소비 63곳: 콘텐츠·회원·권한·마케팅·상품·영업 폼). 네이티브 화살표를 지우고(appearance:none) 토큰 여백을 둔 커스텀 chevron 을 얹어 모든 화면에서 같은 드롭다운을 낸다. 입력(TextField)과 높이·테두리·radius·포커스링을 공유한다.\n\n[네이티브 속성 패스스루 — 계약 prop 이 아니다] 계약 props(isInvalid·children) 외의 표준 <select> 속성(value · defaultValue · onChange · name · id · disabled · ref · aria-* …)은 구현이 <select> 로 그대로 전달한다 (Button/Card 선례). 그래서 raw <select> 의 무손실 드롭인이다 (RHF register spread · 제어형 value 모두 그대로). E2E 가 getByLabel(...).selectOption(...) 로 조작하므로 네이티브 combobox 시맨틱 유지가 계약이다. className/style 은 토큰 규칙 보호를 위해 차단한다. ref 는 계약 prop 이 아니라 forwardRef 로 노출한다 (TextField/Alert 선례).\n\n[isInvalid 이름] 오류 상태 boolean 은 naming-guard(boolean-prop) 규칙상 is 접두가 필요하다 — 앱 원안의 invalid 는 Button 의 fullWidth→isFullWidth 와 같은 판정으로 isInvalid 로 좁혔다 (호출부 10곳 동시 이관). aria-invalid 는 이와 별개로 호출부가 네이티브 패스스루로 함께 준다.",
  "owner": { "code": "component-eng", "design": "ui-design", "figma": "figma-eng" },

  "props": {
    "isInvalid": {
      "type": "boolean",
      "default": false,
      "figmaProperty": "Invalid",
      "description": "오류 상태 — 입력의 controlStyle(invalid) 와 같은 붉은(feedback.danger) 테두리를 낸다. 메시지는 감싸는 FormField 가 렌더한다(이 컨트롤은 테두리만 바꾼다)"
    },
    "children": {
      "type": "node",
      "required": true,
      "description": "<option> 들 — 호출부가 넣는다 (raw <select> 와 동일). 커스텀 컴포넌트로 감싸지 않고 그대로 <select> 자식으로 렌더한다"
    }
  },

  "states": ["default", "focus-visible", "disabled", "error"],

  "tokens": {
    "surface": "color.surface.default",
    "text": "color.text.default",
    "border": "color.border.default",
    "borderInvalid": "color.feedback.danger.border",
    "chevron": "color.text.muted",
    "focusRing": "color.border.focus",
    "radius": "radius.md",
    "paddingX": "space.3",
    "paddingY": "space.2",
    "typography": "typography.label.md"
  },

  "a11y": {
    "role": "combobox",
    "keyboard": ["Tab", "ArrowUp", "ArrowDown", "Enter", "Space"],
    "focusVisible": true,
    "aria": {
      "native-select": "네이티브 <select> 라 role=combobox·키보드·옵션 목록이 브라우저 기본으로 동작한다 — 커스텀 리스트박스가 아니다 (무손실 드롭인)",
      "native-passthrough": "value/onChange/name/id/disabled/ref/aria-* 는 <select> 로 그대로 전달한다 — 새 prop 을 만들지 않는다 (Button/Card 선례)",
      "aria-invalid": "isInvalid=true 면 <select aria-invalid=\"true\"> 를 렌더해 AT 에 무효를 알린다 (색상만의 red border 금지 — WCAG 1.4.1/3.3.1). 에러 메시지 연결(aria-describedby)은 호출부가 네이티브 패스스루로 준다 (TextField 미러). native 를 마지막에 spread 하므로 호출부가 aria-invalid 를 직접 주면 그 값이 우선한다",
      "chevron": "커스텀 chevron 은 pointer-events:none 장식 — aria-hidden. 클릭은 아래 <select> 로 통과한다",
      "aria-required": "required 는 네이티브 패스스루로 들어오지만 구현이 그것을 받아 <select required aria-required=\"true\"> 로 함께 낸다 — 네이티브→AT 매핑에 기대지 않고 필수 여부를 명시한다 (A11Y-11, TextField 미러). required=false 면 두 속성 모두 부여하지 않는다. native 를 마지막에 spread 하므로 호출부가 aria-required 를 직접 주면 그 값이 우선한다. 감싸는 FormField 가 required 를 받은 경우엔 FormField 가 이 컨트롤에 aria-required 를 주입한다(FormField a11y.aria.required-wiring) — 두 경로 모두 같은 결과로 수렴한다"
    },
    "contrastMin": 4.5
  },

  "responsive": {
    "breakpoints": ["sm", "md", "lg"],
    "behavior": "fluid"
  },

  "compat": {
    "breakingSince": null,
    "deprecatedProps": []
  },

  "dependencies": []
}
